{
  "acceptedAt": "2026-09-11T13:34:31Z",
  "acceptedBy": "Max",
  "capturedAt": "2026-09-11T13:34:58.440216Z",
  "issue": {
    "author": "MaksymShostak",
    "body": "## Observed problem\n\nWebVOWL&#39;s adopted pre-release SDLC cannot record an authorised R1 \u2192 R2 scope change without closing the current execution or directly rewriting its lifecycle state. Its guide permits an accepted baseline, but the native `begin --baseline` implementation accepts only a committed GitHub-Issue-shaped JSON snapshot. An existing accepted implementation plan/design cannot be represented directly. A prior independent comparison found this Issue-only baseline representation matches upstream policy; the broader wording in WebVOWL's adopted guide is a local documentation ambiguity, not proof of an upstream schema bug. The principal defect reported here is the missing active execution reclassification path.\n\nObserved on 2026-09-10 in Hadden-Industries/webvowl, `feature/webmcp-integration`, HEAD `2d18a6f1b03ea1d68a71be1ac13071a244d8bad5`. The relevant SDLC implementation is unchanged by the current application work. This is a source-inspected CLI/schema gap, not an executed destructive lifecycle experiment.\n\n## Concrete trigger\n\n1. Begin a bounded R1 correction with the accepted task/plan. WebVOWL&#39;s active `webmcp-resumption` record began at `20b494057a0b074af4eb944ec1b5f032c1642d68` with `riskClass: R1`, `baseline: null`.\n2. The owner expands and accepts the scope to material human/agent action parity. The committed plan records R2 and the accepted design/owner amendments; independent correctness, complete-diff security and native-browser evidence are obtained.\n3. Try to express that transition through the native CLI while preserving execution history and the original starting revision.\n\n## Actual native constraints\n\n- `util/sdlc.py:42-64` rejects every `begin` while an active record exists.\n- `pause` keeps the active record. `resume_task` (line 133 onward) selects `previous_task[&#39;riskClass&#39;]` and exposes no risk/baseline amendment argument.\n- `handoff` is an implementation-completed disposition requiring current verification; using it merely to reroute unfinished work would misstate the lifecycle.\n- `begin --baseline` validates `.sdlc/schemas/accepted-baseline.schema.json`, whose required `issue` object requires a GitHub Issue number, URL and body. The only snapshot command captures a GitHub Issue.\n- WebVOWL's `docs/sdlc/howto.md` and AGENTS.md require risk-proportionate routing and say to reuse accepted intent/baselines rather than invent Issues/plans/reviewers to fill a template. Upstream explicitly requires an accepted Issue version for ordinary R2/R3; that existing policy is not challenged as a schema implementation defect.\n\nThe result is an inaccurate active risk record even when the stronger substantive obligations have been fulfilled. Direct JSON edits, fictitious completion, risk downgrading or fabricated Issue acceptance would damage evidence integrity and are not remedies.\n\n## Expected behaviour / bounded repair direction\n\nProvide a native, owner-referenced scope/risk amendment that retains the prior record and task lineage, selects the new route, records its actual accepted baseline and software-selection evidence, and invalidates incompatible verification. Clarify whether existing accepted non-Issue baselines are supported; if required, supply an honest import/reference mechanism rather than inventing Issue acceptance. Do not silently refresh or reinterpret earlier approvals.\n\nSuggested regression: begin R1; perform an accepted R2 amendment; verify prior state is retained, starting revision cannot omit earlier task changes, the new route requires its obligations, old verification cannot satisfy it, and rejection leaves existing state untouched.\n\n## Current disposition\n\nWebVOWL preserves the original R1 runtime record and separately records the actual R2 scope, accepted plan, independent review and browser evidence. This does not claim the native runtime was successfully reclassified. No SDLC configuration or lifecycle code was changed as a workaround.\n\nDuplicate checks found no matching issue. #33 concerns independent worktree execution and mentions rerouting but does not implement this transition; #35 concerns the separate native security-inventory mismatch.\n\n## Coordinated follow-up acceptance\n\n# Coordinated SDLC issue repair\n\nMax directed completion of the Universal Ontology SDLC issues before downstream\nreconciliation, focused checks during the edit loop, and one final full test of\nthe combined change. He pre-approved proportionate configuration changes, commit\nmessage contents and pushes. Existing explicit product/host limits remain.\n\nUse existing Issue 36 for the R2 lifecycle amendment and coordinated delivery;\nretain its original report and append the acceptance criteria below. This does\nnot accept the historical incident as a proven current host cause. Preserve all\nearlier Issue reports, snapshots and failed evidence.\n\n- AC-0361: An explicitly paused task can resume with an owner-referenced accepted\n  scope/risk amendment. Require a complete new purpose, risk, intent, functionality\n  declaration and applicable baseline/reuse evidence. Reuse native baseline and\n  route validators. Preserve its original starting revision and prior task record,\n  record predecessor lineage, and allocate a fresh task/evidence identity. Failed\n  validation leaves active state and existing evidence unchanged. Same-scope\n  resume remains supported; no fictitious completion or direct JSON edits.\n- AC-0362: Issue 46's readable snapshot introduces no extra terminal blank line\n  for LF/CRLF-terminated bodies, preserves the exact JSON body/hash and original\n  body whitespace, and supplies a final LF when absent. Native Git whitespace\n  checks exercise the generated regular artifact.\n- AC-0363: Issue 45's explicit read-only GitHub Issue-readiness preflight uses\n  native repository metadata. Disabled, missing or malformed availability blocks\n  that readiness claim before any write, with an actionable prerequisite. Enabled\n  Issues establishes only that capability. Label installation remains separate;\n  no feature setting, branch protection or workflow is silently changed.\n- AC-0364: Issue 38's shared retention instructions keep source-named review\n  copies from becoming test inputs: verified archives or a separately owned\n  location outside discovery, with an actual consumer discovery check where\n  unpacked evidence must remain. Preserve failed evidence and product tests;\n  downstream Jest configuration is deferred to its adoption phase.\n- AC-0365: Issue 35's coverage accounting distinguishes intentional native\n  exclusions, a reproduced inventory defect and unassessed required scope. An\n  accepted complete-scope alternative remains explicitly distinct from native\n  scan completion. Reuse the programme's standing decision only within its scope;\n  do not repeat unchanged failing qualification or broaden permissions.\n- AC-0366: Encode reasoning order in the existing engineering principles: first\n  principles, maintained best practice, authoritative specifications/guidance,\n  then preferences. Explicit requirements, permissions and binding constraints\n  remain controlling. Preserve NAM-01 semantic correctness and precision for\n  both new and retained names whose responsibilities change.\n- AC-0367: Reconcile Issues 30/48 against retained native evidence and Issues\n  32/33/40 against qualified merged work. Run only new discriminating diagnostics;\n  preserve unresolved native dependencies and avoid false host-fix claims. The\n  final combined candidate receives the full profile and applicable final\n  assurance once; downstream adoption follows issue disposition.\n\nImplementation surfaces: scripts/sdlc.py, scripts/bootstrap_github_sdlc.py,\ntheir existing/new SDLC tests, and focused paragraphs in\ndocs/sdlc/engineering-principles.md, docs/sdlc/howto.md,\ndocs/sdlc/github-governance.md, docs/sdlc/temporary-artefacts-howto.md and\ndocs/sdlc/codex-security.md. No package, lock, verification profile, hook, plugin,\nglobal configuration, source-package version or deployment-status change is needed.\n\nSelection: extend the existing argparse resume command with an explicit\n--amend-scope mode rather than creating a parallel lifecycle engine. Reuse\nrequire_local_baseline, require_acceptance_reference, current policy routes and\nwrite_json_atomically. Archive the predecessor before replacing active state;\nretain an attempted transition if final publication fails. A new taskId prevents\nold receipts from qualifying. This remains the existing single-owner checkout\nmodel, not a general concurrent amendment service.\n\nFor readiness, extend the existing GitHub helper with --check-issue-readiness;\nthe no-argument label operation remains unchanged. Native gh repo view exposes\nhasIssuesEnabled and nameWithOwner; no custom GitHub transport is needed.\nReference: https://cli.github.com/manual/gh_repo_view.\n",
    "bodySha256": "246f99a7342fbab89ea5b0df9547d790bc50a6a262eaf46c9691f34b9e2fb303",
    "createdAt": "2026-09-10T19:33:23Z",
    "labels": [],
    "number": 36,
    "title": "[Bug]: SDLC cannot reclassify an active task after its accepted scope expands",
    "updatedAt": "2026-09-11T13:33:46Z",
    "url": "https://github.com/Hadden-Industries/universal-ontology/issues/36"
  },
  "repository": "Hadden-Industries/universal-ontology",
  "schemaVersion": 1,
  "version": 1
}
