{
  "acceptedAt": "2026-09-10T23:20:19Z",
  "acceptedBy": "MaksymShostak",
  "capturedAt": "2026-09-10T23:27:29.517937Z",
  "issue": {
    "author": "MaksymShostak",
    "body": "## Accepted change proposed for owner decision\n\nComplete the repository-owned baseline compatibility and proportionate execution\nwork in WP6/WP7 of `docs/plans/sdlc-implementation-plan-2026-09-10.md`, using the\nsupplied detailed WP6/WP7 packages. Include the supplied WP4/WP5 documentation\nrules for truthful host diagnosis and installed security capability qualification.\nRisk: R2, because this changes baseline linkage at a trusted policy boundary.\n\nThe current Issue-snapshot contract remains supported. Reuse the existing ONI\nthree-function plan contract as a small shared module, strengthened at the native\nGit/GitHub object boundary. Do not create a Markdown parser, approval service,\nsecond preflight runner, result cache or distribution platform.\n\n## Intended behavior and acceptance criteria\n\n- AC-601: Local begin/resume/fingerprinting and the trusted PR validator support\n  actual Issue snapshots and previously accepted committed UTF-8 plans. Preserve\n  existing Issue title/body/schema/risk/state/version/history checks. Plan paths\n  are canonical repository-relative POSIX paths under docs/plans with exact .md\n  suffix; reject traversal, aliases, controls, whitespace, colon/stream ambiguity,\n  redirects and non-regular Git entries. Preserve admitted Unicode filenames.\n- AC-602: Native local Git and remote commit/tree/blob readers preserve exact\n  repository, revision, path, mode, object ID and bytes. A plan must be the same\n  regular-file blob/mode at base and head and match local committed bytes. Reject\n  candidate-only, modified, renamed, deleted, type/mode-replaced, malformed or\n  incomplete object evidence. Read candidate data without executing candidate\n  code or widening the trusted workflow's credentials. Handle fork repositories\n  according to the authoritative PR identities.\n- AC-603: The plan route requires exactly one non-placeholder Baseline acceptance\n  reference and a nonempty JSON array of distinct exact source lines, each present\n  once in the accepted plan. Neither metadata nor blob equality authenticates\n  acceptance. Keep owner decision/content binding and product correctness separate;\n  never report a plausible fabricated reference as accepted merely because linkage\n  passes. R0/R1 stay light, and the existing baseline-only Issue route stays distinct.\n- AC-604: Use explicit finite read limits: 1 MiB per baseline blob, 8 MiB per\n  native GitHub JSON response, and 30 seconds per native metadata subprocess.\n  Reject oversized, truncated, undecodable or unavailable input with truthful\n  diagnostics; no silent fallback or baseline repair. Current retained baselines\n  must be checked against these limits before adoption.\n- AC-605: The existing task/handoff guidance exposes only relevant trusted-base,\n  runtime, security-inventory and dependency prerequisites before expensive work.\n  At remote handoff, distinguish actual policy/base/head/tested revisions and\n  workflow event/run/attempt/jobs, including failures and required skipped work.\n  An old event rerun does not assert deployment of newly merged trusted policy.\n- AC-606: Cadence guidance separates risk from rerun frequency, keeps operational\n  progress out of tracked verification inputs, reuses still-applicable decisions,\n  and preserves actual final verification, required independence, fingerprints,\n  native security ownership and original failures. Helper-only changes select\n  the existing SDLC CI controls. No changed assurance threshold or profile is implied.\n- AC-607: WP4/WP5 wording distinguishes requested shell, native diagnosis and actual\n  host interception; installed workflow inventory, other omissions and Windows\n  artifact access retain separate evidence and retirement decisions. Preserve the\n  already approved programme-wide R2 alternative and the user's review deferral.\n\n## Verification and adoption boundary\n\nUse native Git fixtures, the existing .venv, current consumer validators and\nfocused red/green or preservation checks. Qualify malformed paths/bytes/objects,\nfork identity, duplicate metadata and source-line ambiguity, both baseline formats,\ncurrent-evidence invalidation and helper-only CI selection. Run the required full\nprofile on the final frozen elevated-risk object. Independent reviews remain\ndeferred until the requested implementation changes are complete, as directed by\nMax; this is not a waiver or a claim that deferred assurance has occurred.\n\nLand trusted format support through this genuine policy change before relying on\nit for an adopter's feature PR. Source implementation, trusted deployment, host\nqualification and product outcome remain distinct. Actual MCP/SHACL integration,\nONI/WebVOWL changes, host/plugin updates, permission or branch-rule changes,\nresource disposal and product publication require their actual separate scope.\n",
    "bodySha256": "79dbb1657df5f67b237a29bcba9963d262d67df35629402d4020d4ce33800e19",
    "createdAt": "2026-09-10T23:19:48Z",
    "labels": [
      "risk:R2",
      "state:ready-to-baseline"
    ],
    "number": 42,
    "title": "[Change]: Support accepted plans and proportionate SDLC execution",
    "updatedAt": "2026-09-10T23:21:09Z",
    "url": "https://github.com/Hadden-Industries/universal-ontology/issues/42"
  },
  "repository": "Hadden-Industries/universal-ontology",
  "schemaVersion": 1,
  "version": 1
}
