{
  "acceptedAt": "2026-09-10T22:18:33Z",
  "acceptedBy": "MaksymShostak",
  "capturedAt": "2026-09-10T22:19:11.492692Z",
  "issue": {
    "author": "MaksymShostak",
    "body": "## Problem, affected party and desired outcome\n\nImplementation handoff removes the active pointer, while surviving resource\nobligations remain scattered in historical records. The existing status command\nonly prints active state. Maintainers need to find retained resources, their\nconsumers, preservation evidence and next actor after implementation ends.\n\nImplement the WP3 resource-disposition increment of the SDLC implementation plan\ndated 2026-09-10, following WP0 preservation and WP2 checkout exclusivity.\n\n## Accepted behaviour and prohibited effects\n\n- AC-301: Add `record-resource-disposition --input <contained-json-file>`.\n  Strictly validate bounded UTF-8 input against the caller-input branch of the\n  accepted resource-disposition schema. Write and read back a complete, uniquely\n  named snapshot under the coordinator's existing runtime handoff store without\n  replacing history or modifying active tasks, verification receipts or resources.\n- AC-302: Change `status` to a version-1 JSON envelope containing scope, observed\n  time, original active state and its read status, recorded resource dispositions,\n  current observations, attention items, unattributed native worktrees, legacy\n  handoff count and explicit read problems. Support handed-off/idle checkouts.\n  Reserve stdout for JSON through the direct Node and silent npm entry points.\n- AC-303: Resolve history through explicit same-resource supersession. Preserve\n  conflicting leaves; reject dangling, cyclic, self and cross-resource references.\n  Never choose a winner by timestamps, UUID order or filesystem modification time.\n- AC-304: Use native Git porcelain/NUL inventory with no optional locks and a\n  15-second process timeout. Bound reads to 256 KiB per snapshot, 4096 handoff files\n  and 16 MiB aggregate. Report incomplete reads, malformed state, movement and\n  conflicts with usable partial output and nonzero status. Ordinary retention is\n  a successful status read, not a failed implementation.\n- AC-305: Separate recorded assessments from present observations. Show native\n  nesting, changed candidate HEAD and fresh-inspection requirements. Do not read\n  arbitrary referenced files, traverse another worktree's runtime, fetch evidence\n  URLs, execute recorded commands or infer unchanged dirty content from HEAD.\n- AC-306: Record removed-confirmed only with declared actual operation evidence\n  and fresh permitted registration/path absence observations. Reject unresolved\n  containing storage, nested registrations, coordinator/main disposal claims and\n  incomplete readback. No production code removes resources or changes Git state.\n- AC-307: Route helper-only changes to the existing SDLC checks. Exercise recording,\n  idle status, real linked/nested worktrees, malformed/unreadable data, publication\n  faults, Unicode JSON output and absence of resource mutation with native tests.\n- AC-308: Apply the exact accepted policy amendments. Reconcile actual WP0 holdings\n  into the stable coordinator record within existing ownership/storage authority.\n  Preserve held outcomes and pending consumer/removal decisions without fabricating\n  a live removal exercise or claiming all resources have been disposed of.\n\n## Constraints, evidence and owners\n\nR2; new functionality. Max is the accountable scope/policy owner. This task owns\nthe implementation and its metadata store; originating tasks retain their content\nand release decisions. Use existing Python, jsonschema, native Git and the qualified\ncomplete-file/no-overwrite publication composition. Add no dependency or cleanup\nframework. Preserve existing active/verification schemas, package version, trust,\npermissions, retention decisions, failed evidence and unrelated work.\n\nThe proposed resource schema has SHA-256\n`f54cdd769935298add45ac32845c2bcd93e29cfb2671920565d2072db5f4b8f5`.\nThe reconciled seven-file policy/configuration patch has SHA-256\n`140f97fc06cf4cf57a63f354470914535f5036f706368c204a3ec02448e9e1a3`.\nTheir approval remains an actual owner decision, not an implication of these hashes.\n\n## Execution and acceptance boundaries\n\nUse focused tests during implementation. Max directed that further reviews wait\nuntil the entire SDLC plan's implementation changes are finished. Preserve that\ncadence; carry already completed WP2 reviews forward with their original scope.\nRequired final qualification remains distinct from human acceptance and release.\nNo worktree removal, plugin/guard update, new host adoption or downstream product\nchange is authorized by this item. Do not change Issue 33's accepted scope.\n\nThe bounded duplicate search found no matching resource-disposition/retained-handoff\nissue on 2026-09-11. This is not an exhaustive search of private records.\n",
    "bodySha256": "4d4bb0a048290dfab1a0df0e19c0d252abc990adfcb3add281acb845d2341e3c",
    "createdAt": "2026-09-10T22:12:10Z",
    "labels": [
      "risk:R2",
      "sdlc:change",
      "state:ready-to-baseline"
    ],
    "number": 40,
    "title": "[Change]: Keep resource dispositions visible after handoff",
    "updatedAt": "2026-09-10T22:18:33Z",
    "url": "https://github.com/Hadden-Industries/universal-ontology/issues/40"
  },
  "repository": "Hadden-Industries/universal-ontology",
  "schemaVersion": 1,
  "version": 1
}
